codiceIsil;denominazioni.ufficiale;ente;indirizzo.via-piazza;tipologia-amministrativa;tipologia-funzionale;accesso.portatori-handicap;accesso.riservato;comune;position_label;Lat;Long
IT-FI0352;Biblioteca dell'Associazione medico-sportiva fiorentina;Federazione medico-sportiva italiana;Via del Fosso Macinante 13;NON SPECIFICATA;Specializzata;;False;Firenze;117;43,7783592;11,2341053
IT-FI0353;Biblioteca dell'Istituto universitario di scienze motorie - IUSM;Istituto universitario di scienze motorie - IUSM;Viuzzo di Gattaia 9;Universita' statali;Istituto di insegnamento superiore;;;Firenze;118;43,7574857;11,2672262
IT-FI0354;Biblioteca del CEDIP. Centro di documentazione internazionale parchi;Provincia di Firenze;Villa Demidoff;Provincia;Specializzata;;False;Firenze;119;43,789155;11,227355
IT-FI0355;Biblioteca comunale Pablo Neruda;Comune di Capraia e Limite;Piazza 8 Marzo 1944  9;Comune;Pubblica;;False;Firenze;120;43,7424751;10,9764181
IT-FI0356;Biblioteca comunale;Comune di Londa;Via Roma 65;Comune;Pubblica;;False;Firenze;121;43,862369;11,5649402
IT-FI0358;Biblioteca del Museo archeologico e della ceramica;Comune di Montelupo Fiorentino;Via XX Settembre 34;Comune;Specializzata;;False;Firenze;122;43,7331403;11,0218724
IT-FI0360;Biblioteca dell'Istituto araldico Coccia;Istituto araldico Coccia;Borgo S. Croce 6;Accademie, associazioni, fondazioni, istituti (pubblici);Specializzata;;True;Firenze;123;43,771064;11,269969
IT-FI0361;Biblioteca della Misericordia di Firenze;Arciconfraternita della Misericordia;Piazza Duomo 20;Accademie, associazioni, fondazioni, istituti, societa' (privati);Specializzata;;True;Firenze;124;43,772536;11,255564
IT-FI0362;Biblioteca Mediateca - Institut Français Firenze;Institut Français Firenze;Piazza Ognissanti 2;Istituzioni straniere;Specializzata;;False;Firenze;125;43,7723303;11,2453629
IT-FI0363;Biblioteca della Toscana Pietro Leopoldo;Regione Toscana;Piazza dell'Unità italiana, 1;Regione;Specializzata;True;False;Firenze;126;43,775812;11,258017
IT-FI0365;Biblioteca Luigi Crocetti;Regione Toscana;Piazza Brunelleschi, 4;Regione;Specializzata;True;False;Firenze;127;43,7808393;11,2634569
IT-FI0376;Biblioteca dell'Istituto di medicina del lavoro della Facoltà di medicina e chirurgia dell'Università degli studi di Firenze;Università degli studi di Firenze. Facoltà di medicina e chirurgia;Largo Palagi 1;Universita' statali;Istituto di insegnamento superiore;;;Firenze;128;43,8028768;11,2474969
IT-FI0379;Biblioteca della Fondazione Ernesto Ragionieri;Fondazione Ernesto Ragionieri;Via A. Gramsci 282;Accademie, associazioni, fondazioni, istituti (pubblici);Specializzata;;True;Firenze;129;43,8340787;11,2003035
IT-FI0380;Biblioteca del Centro fiorentino di storia e filosofia della scienza;Centro fiorentino di storia e filosofia della scienza;Piazza Alberti 1A;Accademie, associazioni, fondazioni, istituti (pubblici);Specializzata;;False;Firenze;130;43,7696879;11,2808396
IT-FI0381;Biblioteca della Fondazione Herbert P. Horne;Fondazione Herbert P. Horne;Via dei Benci 6;Accademie, associazioni, fondazioni, istituti (pubblici);Specializzata;;True;Firenze;131;43,767473;11,259422
IT-FI0382;Biblioteca della Giunta regionale della Toscana;Regione Toscana;Via di Novoli, 26;Regione;Specializzata;;;Firenze;132;43,792678;11,222356
IT-FI0383;Biblioteca dell'Istituto per l'arte e il restauro;Istituto per l'arte e il restauro;Via dei Fossi 12;Accademie, associazioni, fondazioni, istituti, societa' (privati);Specializzata;;True;Firenze;133;43,772348;11,2490478
IT-FI0384;Biblioteca del Centro studi musicali Ferruccio Busoni;Comune di Empoli;Piazza della Vittoria 16;Comune;Specializzata;;False;Firenze;134;43,72005;10,948292
IT-FI0400;Biblioteca della Fondazione Giovanni Michelucci;Fondazione Giovanni Michelucci;Via Beato Angelico 15;Accademie, associazioni, fondazioni, istituti (pubblici);Specializzata;;True;Firenze;135;43,8072547;11,3317605
IT-FI0404;Biblioteca emeroteca della Manetti & Roberts;Manetti & Roberts SpA;Via Baldanzese 177/186;Accademie, associazioni, fondazioni, istituti, societa' (privati);Specializzata;;True;Firenze;136;43,8481705;11,1728403
IT-FI0405;Biblioteca del Teatro regionale toscano;Centro di documentazione sullo spettacolo e sul teatro;Villa Montalvo Rodriguez;Accademie, associazioni, fondazioni, istituti (pubblici);NON SPECIFICATA;;;Firenze;137;43,8274885;11,1277659
IT-FI0406;Biblioteca del Centro studi dell'Ars nova musicale italiana del Trecento;Centro studi dell'Ars nova musicale del Trecento;Via Borgo Garibaldi 33;Accademie, associazioni, fondazioni, istituti (pubblici);NON SPECIFICATA;;;Firenze;138;43,5488103;11,0408004
IT-FI0407;Piccola biblioteca d'arte;Domenicani. Convento S. Domenico di San Domenico di Fiesole;Via delle Fontanelle;Enti ecclesiastici;Specializzata;;False;Firenze;139;43,7996567;11,2948507
IT-FI0408;Biblioteca di Humour mon amour. Archivio dell'umorismo;Biblioteca di Humour mon amour. Archivio dell'umorismo;Via Calzolari 11;Privati - Famiglie;Specializzata;;False;Firenze;140;43,7851389;11,3612905
IT-FI0412;Biblioteca della Ludoteca centrale;Comune di Firenze;Piazza SS. Annunziata 13;Comune;Pubblica;;False;Firenze;141;43,776072;11,260837
IT-FI0413;Biblioteca della Ludoteca Il castello dei balocchi;Comune di Firenze;Via del Pontormo 92;Comune;Pubblica;;False;Firenze;142;43,8164595;11,2289137
IT-FI0414;Biblioteca della Ludoteca La carrozza di Hans;Comune di Firenze;Via A. Modigliani 101;Comune;Pubblica;;False;Firenze;143;43,7789496;11,2076183
IT-FI0426;Biblioteca del Museo nazionale del Bargello;Ministero dei beni e delle attività culturali e del turismo. Museo nazionale del Bargello;Via dell'Acqua 5;Direzione generale Musei;Specializzata;;True;Firenze;144;43,7703656312858;11,2587085767212
IT-FI0427;"Biblioteca ""Ugo Procacci""";Ministero dei beni e delle attività culturali e del turismo. Opificio delle pietre dure;Via degli Alfani 78;Direzione generale educazione e ricerca;Specializzata;;True;Firenze;145;43,7761175588101;11,2587623644181
IT-FI0428;Biblioteca della Galleria di arte moderna di Palazzo Pitti;Ministero dei beni e delle attività culturali e del turismo. Gallerie degli Uffizi;Piazza Pitti 1;Direzione generale Musei;Specializzata;;True;Firenze;146;43,7654223665056;11,2488514197128
IT-FI0431;Biblioteca degli Uffizi;Ministero dei beni e delle attività culturali e del turismo. Gallerie degli Uffizi;Via della Ninna 5;Direzione generale Musei;Specializzata;;False;Firenze;147;43,7690519;11,256184
IT-FI0432;Biblioteca dell'Istituto sperimentale per la selvicoltura. Sezione staccata di Firenze;Istituto sperimentale per la selvicoltura;Via delle Cascine 1;Aziende ed amministrazioni dello stato ad ordinamento autonomo;Specializzata;;True;Firenze;148;43,7843198;11,2231417
IT-FI0433;Biblioteca della Scuola di guerra aerea. Scuola applicazione aeronautica militare;Ministero della difesa;Viale dell'Aeronautica 14;Presidenza del consiglio dei ministri e ministeri;Specializzata;;True;Firenze;149;43,7858658;11,2129308
IT-FI0435;Biblioteca del Dopolavoro dei postelegrafonici;Dopolavoro dei postelegrafonici;Via Pellicceria 3;Aziende ed amministrazioni dello stato ad ordinamento autonomo;Pubblica;;True;Firenze;150;43,770003;11,253538
IT-FI0436;Biblioteca del Monastero olivetano dei SS. Giuseppe e Benedetto;Benedettini olivetani. Monastero dei SS. Giuseppe e Benedetto;Via Feliceto 8;Enti ecclesiastici;Specializzata;;True;Firenze;151;43,7839031;11,3193274
IT-FI0438;Biblioteca della Chiesa evangelica valdese;Chiesa evangelica valdese. Comunità di Firenze;Via Manzoni 21;Enti ecclesiastici;Specializzata;;True;Firenze;152;43,7722948;11,2696543
IT-FI0439;Biblioteca della Chiesa luterana;Chiesa luterana. Comunità di Firenze;Via dei Bardi 20;Enti ecclesiastici;Specializzata;;True;Firenze;153;43,7654993;11,2566913
IT-FI0440;Biblioteca della Chiesa russa ortodossa;Chiesa russa ortodossa. Comunità di Firenze;Via Leone X  8;Enti ecclesiastici;Specializzata;;False;Firenze;154;43,7838903;11,2544994
IT-FI0441;Biblioteca della S. Chiesa ortodossa d'Italia;S. Chiesa ortodossa d'Italia. Comunità di Firenze;Via Casentino 27;Enti ecclesiastici;Specializzata;;True;Firenze;155;43,7966528;11,2177711
IT-FI0442;Biblioteca Silvano Piovanelli;Facoltà Teologica dell'Italia Centrale;Viale Ludovico Ariosto, 13;Enti ecclesiastici;Specializzata;True;False;Firenze;156;43,8088496;11,2547883
IT-FI0445;Biblioteca dell'Accademia italiana di stenografia e dattilografia G. Aliprandi;Accademia italiana di stenografia e dattilografia G. Aliprandi;Piazza Duomo 6;Accademie, associazioni, fondazioni, istituti (pubblici);Specializzata;;True;Firenze;157;43,7734623;11,2557285
IT-FI0446;Biblioteca della Fondazione Giorgio Ronchi;Fondazione Giorgio Ronchi;Via S. Felice a Ema 20;Accademie, associazioni, fondazioni, istituti (pubblici);Specializzata;;False;Firenze;158;43,7468221;11,2396628
IT-FI0447;Biblioteca della Fondazione scienza e tecnica;Fondazione scienza e tecnica;Via Giusti 27;Accademie, associazioni, fondazioni, istituti (pubblici);Specializzata;;False;Firenze;159;43,776858;11,2646945
IT-FI0448;Biblioteca della Fondazione scienza per l'ambiente;Fondazione scienza per l'ambiente;Viale Galileo 32;Accademie, associazioni, fondazioni, istituti (pubblici);Specializzata;;True;Firenze;160;43,7543645;11,2544779
IT-FI0449;Biblioteca dell'Archivio contemporaneo Alessandro Bonsanti;Gabinetto scientifico-letterario Giovan Pietro Vieusseux;Via Maggio 42;Accademie, associazioni, fondazioni, istituti (pubblici);Specializzata;;True;Firenze;161;43,766848;11,248809
IT-FI0451;Biblioteca dell'Istituto di psicosintesi;Istituto di psicosintesi;Via S. Domenico 16;Accademie, associazioni, fondazioni, istituti (pubblici);Specializzata;;False;Firenze;162;43,788242;11,2856497
IT-FI0453;Biblioteca dell'Istituto di studi politici Renato Branzi;Istituto di studi politici Renato Branzi;Via La Pira 17;Accademie, associazioni, fondazioni, istituti (pubblici);Specializzata;;False;Firenze;163;43,7796802;11,2608001
IT-FI0454;Biblioteca dell'Istituto Gramsci toscano;Istituto Gramsci toscano;Via G. Orsini 44;Accademie, associazioni, fondazioni, istituti (pubblici);Specializzata;;False;Firenze;164;43,763363;11,2778195
IT-FI0455;Biblioteca della Fondazione mediateca regionale toscana;Fondazione mediateca regionale toscana;Via Lungarno A. Moro 4;Accademie, associazioni, fondazioni, istituti (pubblici);Specializzata;;False;Firenze;165;43,7672007;11,2948719
IT-FI0458;Biblioteca della Florida State University;Florida State University of Tallahasse;Borgo Albizi 15;Universita' non statali;Istituto di insegnamento superiore;;True;Firenze;166;43,7714774;11,2618339
IT-FI0459;Biblioteca della Fondazione di Villa Romana;Fondazione di Villa Romana;Via Senese 68;Istituzioni straniere;Specializzata;;True;Firenze;167;43,7558;11,239896
IT-FI0460;Biblioteca della Syracuse University. Semester in Italy;Syracuse University. Semester in Italy;Via Della Robbia 99;Universita' non statali;Istituto di insegnamento superiore;;True;Firenze;168;43,7799792;11,2680821
IT-FI0461;Biblioteca dello Studio Art Center International. SACI;Studio Art Center International;Via S. Gallo 30;Universita' non statali;Istituto di insegnamento superiore;;True;Firenze;169;43,7788624;11,2575193
IT-FI0462;Biblioteca Gonzaga in Florence;Gonzaga University;Piazza Antinori 3;Universita' non statali;Istituto di insegnamento superiore;;True;Firenze;170;43,772709;11,25136
IT-FI0463;Biblioteca dell'Associazione amici dei musei fiorentini;Associazione amici dei musei fiorentini;Via degli Alfani 39;Accademie, associazioni, fondazioni, istituti (pubblici);Specializzata;;True;Firenze;171;43,774666;11,261554
IT-FI0464;Biblioteca del Centro di esercitazioni ai metodi per l'educazione attiva;Centro di esercitazione ai metodi per l'educazione attiva. CEMEA;Via S. Salvi 12;Accademie, associazioni, fondazioni, istituti, societa' (privati);Specializzata;;True;Firenze;172;43,77053;11,285435
IT-FI0465;Biblioteca del WWF;World Wildlife Fund;Via S. Anna 3;Organizzazioni internazionali;Specializzata;;False;Firenze;173;43,781276;11,2604927
IT-FI0466;Biblioteca dell'Associazione Italia-Cina;Associazione Italia-Cina;Via S. Gallo 15;Accademie, associazioni, fondazioni, istituti (pubblici);Specializzata;;False;Firenze;174;43,7778282;11,2567043
IT-FI0467;Biblioteca dell'Associazione Italia-Cuba;Associazione Italia-Cuba;Viale Giannotti 13, presso Circolo Vie Nuove;Accademie, associazioni, fondazioni, istituti (pubblici);Specializzata;;False;Firenze;175;43,762058;11,283258
IT-FI0468;Biblioteca dell'Associazione Italia-Russia;Associazione Italia-Russia;Via di Capaccio 1;Accademie, associazioni, fondazioni, istituti (pubblici);Specializzata;;True;Firenze;176;43,7697024;11,2539365
IT-FI0470;Biblioteca di Italia nostra;Italia nostra;Viale Gramsci 9/A;Accademie, associazioni, fondazioni, istituti, societa' (privati);Specializzata;;False;Firenze;177;43,7720445;11,2707852999999
IT-FI0471;Biblioteca popolare Le Cure;Cooperativa Gustavo Console;Via L. La Vista 5;Accademie, associazioni, fondazioni, istituti, societa' (privati);Pubblica;;False;Firenze;178;43,7869632;11,2679412
IT-FI0472;Biblioteca del Nuovo Pignone;Nuovo Pignone SpA;Via F. Matteucci 2;Accademie, associazioni, fondazioni, istituti, societa' (privati);Specializzata;;True;Firenze;179;43,8011822;11,2249177
IT-FI0474;Biblioteca delle Industrie farmaceutiche riunite Menarini;Industrie farmaceutiche riunite Menarini;Via Sette Santi 3;Accademie, associazioni, fondazioni, istituti, societa' (privati);Specializzata;;False;Firenze;180;43,7803044;11,276527
IT-FI0475;Biblioteca del Centro congressi;Centro internazionale dei congressi;Piazza Adua 1;Accademie, associazioni, fondazioni, istituti, societa' (privati);Pubblica;;True;Firenze;181;43,7778299;11,2494615
IT-FI0476;Biblioteca del Centro studi danza;Associazione culturale Centro studi danza;Via Monteverdi 3/A;Accademie, associazioni, fondazioni, istituti (pubblici);Specializzata;;True;Firenze;182;43,7851885;11,2357139
IT-FI0477;Biblioteca del Centro di documentazione e archivio storico Il Sessantotto;Centro di documentazione e archivio storico Il Sessantotto;Via Giano della Bella 22;Accademie, associazioni, fondazioni, istituti, societa' (privati);Specializzata;;False;Firenze;183;43,7642062;11,2401675
IT-FI0478;Biblioteca di documentazione del Centro SMID;Centro SMID. Studio multicentrico italiano sulla demenza;Viale Il Prato 58;Accademie, associazioni, fondazioni, istituti, societa' (privati);Specializzata;;True;Firenze;184;43,77626;11,241669
IT-FI0479;Biblioteca del Centro tecnico federale Luigi Ridolfi;Federazione italiana giuoco calcio;Viale G. D'Annunzio 138;Aziende ed amministrazioni dello stato ad ordinamento autonomo;Specializzata;;True;Firenze;185;43,780913;11,302278
IT-FI0480;Biblioteca del Gruppo micologico fiorentino;Gruppo micologico fiorentino;Via della Torre del Gallo 30;Accademie, associazioni, fondazioni, istituti, societa' (privati);Specializzata;;True;Firenze;186;43,7519761;11,2565468
IT-FI0481; Biblioteca dell'Istituto per la storia e la prevenzione oncologica - ISPO;Azienda ospedaliera Careggi;Viale A. Volta 171;Aziende ed enti del servizio sanitario nazionale;Specializzata;;False;Firenze;187;43,7852117;11,2729935
IT-FI0482;Biblioteca medica Ennio Montoni;Azienda Sanitaria 10 di Firenze;Via Torregalli 3;Aziende ed enti del servizio sanitario nazionale;Specializzata;;True;Firenze;188;43,7583345;11,2027266
IT-FI0483;Biblioteca di ARPAT;Agenzia regionale per la protezione ambientale della Toscana - ARPAT;Via Porpora, 22;Regione;Specializzata;True;False;Firenze;189;43,7823798;11,2333719
IT-FI0484;Biblioteca del Gruppo ricerche scientifiche e tecniche subacquee - GRSTS;Gruppo ricerche scientifiche e tecniche subacquee;Vicolozzo del Pozzetto, Viale Europa;Accademie, associazioni, fondazioni, istituti (pubblici);Specializzata;;True;Firenze;190;43,7570203;11,2975622
IT-FI0486;Biblioteca della Fondazione Bassi Montanelli;Fondazione Bassi Montanelli;Via G. di San Giorgio 2;Accademie, associazioni, fondazioni, istituti (pubblici);Specializzata;;False;Firenze;191;43,7298636;10,8073806
IT-FI0496;Biblioteca del Centro studi pedagogici Ernesto Codignola;Centro studi pedagogici Ernesto Codignola;Via Pacinotti;Accademie, associazioni, fondazioni, istituti (pubblici);Specializzata;;False;Firenze;192;43,7492172;11,1849199
IT-FI0497;Biblioteca del Museo Richard-Ginori della Manifattura di Doccia;Museo Richard-Ginori della Manifattura di Doccia;Viale Pratese 31;Accademie, associazioni, fondazioni, istituti (pubblici);Specializzata;;True;Firenze;193;43,839261;11,190482
IT-FI0498;Biblioteca comunale;Comune di Marradi;Via Castelnaudary, 5;Comune;Pubblica;;False;Firenze;194;44,0756656748536;11,6127461018524
IT-FI0499;Biblioteca dell'Istituto antoniano;Rogazionisti. Istituto antoniano di Fiesole;Poggio Gherardo 2;Enti ecclesiastici;Specializzata;;True;Firenze;195;43,7853075;11,3051714
IT-FI0500;Biblioteca delle Officine Galileo;Officine Galileo;Via A. Einstein 35;Accademie, associazioni, fondazioni, istituti, societa' (privati);Specializzata;;True;Firenze;196;43,844013;11,150545
IT-FI0501;BiblioteCaNova Isolotto;Comune di Firenze;Via Chiusi, 4/3 a;Comune;Pubblica;;False;Firenze;197;43,78009927628;11,1965295443054
IT-FI0502;Biblioteca dell'Istituto statale d'arte;Ministero dell'istruzione, dell'università e della ricerca;Piazzale di Porta Romana 9;Presidenza del consiglio dei ministri e ministeri;Specializzata;;False;Firenze;198;43,7603339;11,2423668
IT-FI0505;Biblioteca del Teatro della Pergola - Fondazione Teatro della Toscana;Fondazione Teatro della Toscana;Via della Pergola n. 18 (Portineria);Accademie, associazioni, fondazioni, istituti, societa' (privati);Specializzata;;True;Firenze;199;43,7733357425727;11,261962285389
IT-FI0506;Biblioteca dell'Associazione cattolica esercenti cinema;Associazione cattolica esercenti cinema. Servizio toscano assistenza sale;Piazza Stazione 2;Enti ecclesiastici;Specializzata;;False;Firenze;200;43,7776146;11,2490022
IT-FI0507;Biblioteca di Settignano;Biblioteca di Settignano;Piazza Tommaseo 14;Accademie, associazioni, fondazioni, istituti, societa' (privati);Pubblica;;;Firenze;201;43,7827314;11,3217598
IT-FI0509;Biblioteca del Servizio materiale e trazione delle FFSS;Ente ferrovie dello stato. Dipartimento organizzazione;Viale S. Lavagnini 58;Accademie, associazioni, fondazioni, istituti, societa' (privati);Specializzata;;True;Firenze;202;43,7823992;11,254795
IT-FI0517;Biblioteca delle suore Carmelitane di S. Teresa;Carmelitane di S. Teresa di Firenze. Suore. Casa madre in Campibisenzio;Via Torricella 111;Enti ecclesiastici;Pubblica;;;Firenze;203;43,815688;11,1302543
IT-FI0518;Biblioteca dell'Istituto Calasanzio;Scolopi. Istituto Colasanzio di Empoli;Via J. Carrucci 23;Enti ecclesiastici;Pubblica;;True;Firenze;204;43,7198419;10,9511093
IT-FI0519;Biblioteca Convento San Francesco;Provincia toscana di San Francesco Stimmatizzato;Piazza S. Francesco, 10;Enti ecclesiastici;Importante non specializzata;True;False;Firenze;205;43,6181445;11,4732943
IT-FI0521;Biblioteca del Convento di S. Spirito;Agostiniani OSA. Convento S. Spirito di Firenze;Piazza S. Spirito 30;Enti ecclesiastici;Pubblica;;;Firenze;206;43,766905;11,247929
IT-FI0523;Biblioteca storica antica delle Scuole Pie Fiorentine;Provincia Toscana dei padri Scolopi;Via Cavour, 94;Enti ecclesiastici;Importante non specializzata;True;False;Firenze;207;43,781499;11,26129
IT-FI0524;Biblioteca del Convento dei frati minori;Frati minori OFM. Convento S. Lucia di Lastra a Signa;Via del Serraglio 22;Enti ecclesiastici;Pubblica;;True;Firenze;208;43,764799;11,0993809
IT-FI0528;Biblioteca comunale;Comune di Reggello;Via E. Berlinguer , 2;Comune;Pubblica;;False;Firenze;209;43,6755363360977;11,528094219574
IT-FI0529;Biblioteca dell'Istituto Ernesto De Martino;Istituto Ernesto De Martino per la conoscenza critica e la presenza alternativa del mondo popolare e del mondo proletario;Via Scardassieri 47;Accademie, associazioni, fondazioni, istituti (pubblici);Specializzata;;False;Firenze;210;43,8290293;11,192429
IT-FI0530;Biblioteca della Fondazione Giorgio La Pira;Convento di San Marco e Fondazione La Pira;Via G. La Pira 5;Accademie, associazioni, fondazioni, istituti, societa' (privati);Specializzata;;False;Firenze;211;43,7788202;11,2601192
IT-FI0533;Biblioteca del Centro cattolico studi sociali;;Piazza della Stazione 4/9;Enti ecclesiastici;NON SPECIFICATA;;;Firenze;212;43,775222;11,247896
IT-FI0539;Biblioteca di analisi globale e applicazioni. IAGA del CNR;Consiglio nazionale delle ricerche - CNR;Via S. Marta 13/A;Aziende ed amministrazioni dello stato ad ordinamento autonomo;Specializzata;;True;Firenze;213;43,7987614;11,2552954
IT-FI0540;Biblioteca per l'agrometeorologia e l'analisi ambientale applicata all'agricoltura. IATA del CNR;Consiglio nazionale delle ricerche - CNR;Via Caproni 8;Aziende ed amministrazioni dello stato ad ordinamento autonomo;Specializzata;;True;Firenze;214;43,7983061;11,1914023
IT-FI0546;Biblioteca della Società di studi geografici;Società di studi geografici;Via S. Gallo 10;Accademie, associazioni, fondazioni, istituti (pubblici);NON SPECIFICATA;;;Firenze;215;43,7775904;11,2565184
IT-FI0547;Biblioteca di storia della fotografia Fratelli Alinari;Fratelli Alinari. IDEA;Largo Fratelli Alinari 15;Accademie, associazioni, fondazioni, istituti, societa' (privati);Specializzata;;True;Firenze;216;43,7762363;11,2505426
IT-FI0548;Children's Lending Library;Comitato volontario per il children's Lending Library;Via B. Ruccellai 13;Accademie, associazioni, fondazioni, istituti (pubblici);Pubblica;;False;Firenze;217;43,7762043;11,2432626
IT-FI0549;Biblioteca del FILI. Centro documentazione e informazione La cooperativa delle donne;Centro documentazione e informazione La cooperativa delle donne;Via Fiesolana 2/B;Accademie, associazioni, fondazioni, istituti (pubblici);Specializzata;;False;Firenze;218;43,7717245;11,2626386
IT-FI0552;Biblioteca dell'Istituto avventista di cultura biblica;Istituto avventista di cultura biblica;Via del Pergolino 12;Enti ecclesiastici;Specializzata;;False;Firenze;219;43,8048446;11,2516802
IT-FI0555;Biblioteca del Centro di documentazione salute mentale;Regione Toscana;Via Val di Pesa 1;Regione;Specializzata;;False;Firenze;220;43,7924128;11,2229275
IT-FI0556;Biblioteca del Centro regionale di documentazione agricola;Regione Toscana. ARSIA;Via Pietrapiana;Regione;Specializzata;;False;Firenze;221;43,7714327;11,2646059
IT-FI0557;Centro cultura della legalità democratica;Regione Toscana;Piazza Duomo, 10;Regione;Specializzata;True;False;Firenze;222;43,7753146;11,2562174
IT-FI0559;Biblioteca dell'Istituto di ricerche economiche e sociali della Toscana. IRES;Istituto di ricerche economiche e sociali della Toscana;Lungarno Colombo 66;Accademie, associazioni, fondazioni, istituti (pubblici);Specializzata;;False;Firenze;223;43,7655853;11,2775864
IT-FI0561;Biblioteca BIBLIA. Associazione laica di cultura biblica;BIBLIA. Associazione laica di cultura biblica;Via A. da Settimello 129;Accademie, associazioni, fondazioni, istituti (pubblici);Specializzata;;True;Firenze;224;43,8487277;11,1835018
IT-FI0562;Biblioteca dell'Istituto socialista di studi storici;Istituto di studi storici;Via P. Toscanelli 6;Accademie, associazioni, fondazioni, istituti (pubblici);NON SPECIFICATA;;;Firenze;225;43,7852738;11,2611981
IT-FI0563;Biblioteca dell'Accademia nazionale di entomologia;Accademia nazionale di entomologia;Via di Lanciola 12;Accademie, associazioni, fondazioni, istituti (pubblici);Specializzata;;False;Firenze;226;43,7334564;11,2537366
IT-FI0564;Biblioteca del Dipartimento di scienze e tecnologie alimentari e microbiologiche. Sezione di industrie e tecnologie alimentari dell'Università degli studi di Firenze;Università degli studi di Firenze. Dipartimento di scienze e tecnologie alimentari e microbiologiche;Via Donizetti 6;Universita' statali;Istituto di insegnamento superiore;;;Firenze;227;43,7843559;11,2273235
IT-FI0567;Biblioteca Il Torrione al 334;Il Torrione al 334;Via di Brozzi 334;Accademie, associazioni, fondazioni, istituti (pubblici);Pubblica;;False;Firenze;228;43,7940214;11,1612412
IT-FI0568;Biblioteca della Fondazione Spadolini Nuova Antologia;Fondazione Spadolini Nuova Antologia;Via Pian dei Giullari 139;Accademie, associazioni, fondazioni, istituti (pubblici);Specializzata;;True;Firenze;229;43,7446544;11,2667721
IT-FI0569;Biblioteca del Centro di documentazione sull'Antifascismo e la Resistenza nell'empolese e bassa Valdelsa;Comune di Empoli;Via Cavour 36;Comune;Specializzata;;False;Firenze;230;43,7180537;10,9464496
IT-FI0570;Biblioteca della Società toscana di orticoltura;Società toscana di orticoltura;Via delle Terme 4;Accademie, associazioni, fondazioni, istituti (pubblici);Specializzata;;False;Firenze;231;43,7699001;11,2525963
IT-FI0574;Archivio della SS. Annunziata;;Piazza della Santissima Annunziata;NON SPECIFICATA;NON SPECIFICATA;;;Firenze;232;43,7764241;11,2605861
IT-FI0575;Biblioteca di scienze. Fondo librario dell'Orto botanico - Giardino dei semplici dell'Università degli studi di Firenze;Università degli studi di Firenze;Via Pier Antonio Micheli 3;Universita' statali;Istituto di insegnamento superiore;;True;Firenze;233;43,7793644;11,2617193999999
IT-FI0577;Coordinamento centrale delle biblioteche - Università degli studi di Firenze;Università degli studi di Firenze;Piazza S. Marco 4;NON SPECIFICATA;NON SPECIFICATA;;;Firenze;234;43,777674;11,25944
IT-FI0583;Biblioteca del Centro interuniversitario di ingegneria delle microonde per applicazioni spaziali;Politecnico di Torino e Università degli studi di Ancona, Bologna, Firenze, Palermo e Roma Tor Vergata;Via C. Lombroso 6/17;Universita' statali;Istituto di insegnamento superiore;;;Firenze;235;43,7967567;11,2429026
